{
  "dataset_name": "命题二：外呼任务对话模型指令示例（评测版）（用户模拟器版）",
  "source_file": "/Users/zhangpq/Desktop/code/多轮指令对话系统/data/processed/dialog_instruction_eval_examples.json",
  "schema_ref": "/Users/zhangpq/Desktop/code/多轮指令对话系统/data/schemas/user_simulator.schema.json",
  "scenario_count": 14,
  "scenarios": [
    {
      "scenario_id": "1_cooperative_user",
      "instruction_id": "1",
      "domain": "rider_operations",
      "profile_id": "cooperative_user",
      "persona": "配合型用户",
      "goal": "愿意听完说明，并就关键点做少量确认。",
      "style": [
        "简短回应",
        "接受引导",
        "会确认核心信息"
      ],
      "trigger_scenarios": [
        "baseline"
      ],
      "must_cover": [
        "允许模型完成主流程",
        "在结尾前提出1个关键确认问题"
      ],
      "initial_user_utterance": "是我，你说。",
      "initial_state_id": "listen_and_confirm",
      "max_turns": 4,
      "states": [
        {
          "state_id": "listen_and_confirm",
          "intent": "listen",
          "default_response": "行，我知道了，还有吗？",
          "expected_agent_signals": [
            "合同",
            "低延迟",
            "标准直播",
            "配送",
            "发课"
          ],
          "fallback_response": "你先说重点。",
          "transition_to": "ask_one_question",
          "terminal": false
        },
        {
          "state_id": "ask_one_question",
          "intent": "clarify",
          "default_response": "那具体我接下来怎么做？",
          "expected_agent_signals": [
            "可以",
            "怎么",
            "流程",
            "注意"
          ],
          "fallback_response": "那我接下来要做什么？",
          "transition_to": "close_call",
          "terminal": false
        },
        {
          "state_id": "close_call",
          "intent": "close",
          "default_response": "行，那先这样。",
          "expected_agent_signals": [
            "再见",
            "先这样",
            "有问题"
          ],
          "fallback_response": "我知道了。",
          "transition_to": null,
          "terminal": true
        }
      ],
      "instruction_summary": {
        "task": "致电\"飞毛腿\"骑手，通知他们今天合同已成功签署，并提醒他们完成配送任务。",
        "opening_line": "你好，请问是${rider_name}吗？我是站长。我看到你已报名飞毛腿。请记住，午餐和晚餐高峰期需要上线。单日合同每天至少完成 **X 单**；多日合同每天至少完成 **Y 单**。",
        "required_information": [
          "告知骑手今天飞毛腿合同已生效，并询问他们是否可以开始配送。",
          "说明单日飞毛腿合同需要**连续 Y 天**完成配送；否则合同将受到影响。",
          "尽量挽留不想配送的骑手，鼓励能配送的骑手，并提醒他们注意安全。",
          "说明飞毛腿报名是按排名进行的，并非站长干预。骑手应减少拒单、取消和超时。在恶劣天气下工作、订单量更高，有助于保住飞毛腿资格。",
          "目前，许多骑手正在申请飞毛腿。如果你无法连续配送 **Y 天**，你的名额可能会被他人占用。"
        ]
      }
    },
    {
      "scenario_id": "1_silent_user",
      "instruction_id": "1",
      "domain": "rider_operations",
      "profile_id": "silent_user",
      "persona": "沉默型用户",
      "goal": "只做极简回应，测试模型能否主动推进流程而不过度重复。",
      "style": [
        "少字回答",
        "被动",
        "不主动提问"
      ],
      "trigger_scenarios": [
        "minimal_response"
      ],
      "must_cover": [
        "连续两轮只给极简反馈",
        "观察模型是否仍能推进主流程"
      ],
      "initial_user_utterance": "嗯。",
      "initial_state_id": "minimal_ack_1",
      "max_turns": 4,
      "states": [
        {
          "state_id": "minimal_ack_1",
          "intent": "minimal_ack",
          "default_response": "嗯。",
          "expected_agent_signals": [
            "合同",
            "低延迟",
            "直播",
            "配送"
          ],
          "fallback_response": "你继续。",
          "transition_to": "minimal_ack_2",
          "terminal": false
        },
        {
          "state_id": "minimal_ack_2",
          "intent": "minimal_ack",
          "default_response": "好。",
          "expected_agent_signals": [
            "要求",
            "规则",
            "注意",
            "怎么做"
          ],
          "fallback_response": "还有吗？",
          "transition_to": "close_call",
          "terminal": false
        },
        {
          "state_id": "close_call",
          "intent": "close",
          "default_response": "那先这样。",
          "expected_agent_signals": [
            "先这样",
            "有问题",
            "再联系"
          ],
          "fallback_response": "我知道了。",
          "transition_to": null,
          "terminal": true
        }
      ],
      "instruction_summary": {
        "task": "致电\"飞毛腿\"骑手，通知他们今天合同已成功签署，并提醒他们完成配送任务。",
        "opening_line": "你好，请问是${rider_name}吗？我是站长。我看到你已报名飞毛腿。请记住，午餐和晚餐高峰期需要上线。单日合同每天至少完成 **X 单**；多日合同每天至少完成 **Y 单**。",
        "required_information": [
          "告知骑手今天飞毛腿合同已生效，并询问他们是否可以开始配送。",
          "说明单日飞毛腿合同需要**连续 Y 天**完成配送；否则合同将受到影响。",
          "尽量挽留不想配送的骑手，鼓励能配送的骑手，并提醒他们注意安全。",
          "说明飞毛腿报名是按排名进行的，并非站长干预。骑手应减少拒单、取消和超时。在恶劣天气下工作、订单量更高，有助于保住飞毛腿资格。",
          "目前，许多骑手正在申请飞毛腿。如果你无法连续配送 **Y 天**，你的名额可能会被他人占用。"
        ]
      }
    },
    {
      "scenario_id": "1_busy_user",
      "instruction_id": "1",
      "domain": "rider_operations",
      "profile_id": "busy_user",
      "persona": "忙碌型用户",
      "goal": "尽快结束通话，观察模型是否能压缩表达并保留重点。",
      "style": [
        "打断",
        "催促",
        "低耐心"
      ],
      "trigger_scenarios": [
        "user_says_busy_early"
      ],
      "must_cover": [
        "在前两轮内表达很忙",
        "若模型继续说明则保持短句回应"
      ],
      "initial_user_utterance": "我现在忙，你快点说。",
      "initial_state_id": "interrupt_early",
      "max_turns": 4,
      "states": [
        {
          "state_id": "interrupt_early",
          "intent": "interrupt",
          "default_response": "我很忙，你一句话说重点。",
          "expected_agent_signals": [
            "1分钟",
            "简短",
            "重点",
            "马上说完"
          ],
          "fallback_response": "你太长了，快点。",
          "transition_to": "push_for_summary",
          "terminal": false
        },
        {
          "state_id": "push_for_summary",
          "intent": "compress",
          "default_response": "好，你继续，尽量短点。",
          "expected_agent_signals": [
            "重点",
            "简单说",
            "一句话"
          ],
          "fallback_response": "还是太绕了。",
          "transition_to": "close_quickly",
          "terminal": false
        },
        {
          "state_id": "close_quickly",
          "intent": "close",
          "default_response": "行，我知道了，先挂了。",
          "expected_agent_signals": [
            "先这样",
            "稍后",
            "再联系"
          ],
          "fallback_response": "先这样吧。",
          "transition_to": null,
          "terminal": true
        }
      ],
      "instruction_summary": {
        "task": "致电\"飞毛腿\"骑手，通知他们今天合同已成功签署，并提醒他们完成配送任务。",
        "opening_line": "你好，请问是${rider_name}吗？我是站长。我看到你已报名飞毛腿。请记住，午餐和晚餐高峰期需要上线。单日合同每天至少完成 **X 单**；多日合同每天至少完成 **Y 单**。",
        "required_information": [
          "告知骑手今天飞毛腿合同已生效，并询问他们是否可以开始配送。",
          "说明单日飞毛腿合同需要**连续 Y 天**完成配送；否则合同将受到影响。",
          "尽量挽留不想配送的骑手，鼓励能配送的骑手，并提醒他们注意安全。",
          "说明飞毛腿报名是按排名进行的，并非站长干预。骑手应减少拒单、取消和超时。在恶劣天气下工作、订单量更高，有助于保住飞毛腿资格。",
          "目前，许多骑手正在申请飞毛腿。如果你无法连续配送 **Y 天**，你的名额可能会被他人占用。"
        ]
      }
    },
    {
      "scenario_id": "1_skeptical_user",
      "instruction_id": "1",
      "domain": "rider_operations",
      "profile_id": "skeptical_user",
      "persona": "质疑型用户",
      "goal": "追问规则依据，测试模型是否按知识点稳定回答。",
      "style": [
        "追问细节",
        "怀疑规则",
        "要求解释原因"
      ],
      "trigger_scenarios": [
        "faq_challenge"
      ],
      "must_cover": [
        "至少追问2个知识点",
        "检查是否出现编造信息"
      ],
      "initial_user_utterance": "什么意思？你先说清楚。",
      "initial_state_id": "question_rules",
      "max_turns": 4,
      "states": [
        {
          "state_id": "question_rules",
          "intent": "challenge",
          "default_response": "为什么要这样？依据是什么？",
          "expected_agent_signals": [
            "合同",
            "升级",
            "规则",
            "低延迟"
          ],
          "fallback_response": "你说得太笼统了。",
          "transition_to": "ask_detail",
          "terminal": false
        },
        {
          "state_id": "ask_detail",
          "intent": "faq",
          "default_response": "那价格/要求具体怎么算？",
          "expected_agent_signals": [
            "价格",
            "要求",
            "知识",
            "规则"
          ],
          "fallback_response": "那具体标准是什么？",
          "transition_to": "close_after_answer",
          "terminal": false
        },
        {
          "state_id": "close_after_answer",
          "intent": "close",
          "default_response": "行，我大概明白了。",
          "expected_agent_signals": [
            "解释",
            "就是",
            "因此"
          ],
          "fallback_response": "先这样吧。",
          "transition_to": null,
          "terminal": true
        }
      ],
      "instruction_summary": {
        "task": "致电\"飞毛腿\"骑手，通知他们今天合同已成功签署，并提醒他们完成配送任务。",
        "opening_line": "你好，请问是${rider_name}吗？我是站长。我看到你已报名飞毛腿。请记住，午餐和晚餐高峰期需要上线。单日合同每天至少完成 **X 单**；多日合同每天至少完成 **Y 单**。",
        "required_information": [
          "告知骑手今天飞毛腿合同已生效，并询问他们是否可以开始配送。",
          "说明单日飞毛腿合同需要**连续 Y 天**完成配送；否则合同将受到影响。",
          "尽量挽留不想配送的骑手，鼓励能配送的骑手，并提醒他们注意安全。",
          "说明飞毛腿报名是按排名进行的，并非站长干预。骑手应减少拒单、取消和超时。在恶劣天气下工作、订单量更高，有助于保住飞毛腿资格。",
          "目前，许多骑手正在申请飞毛腿。如果你无法连续配送 **Y 天**，你的名额可能会被他人占用。"
        ]
      }
    },
    {
      "scenario_id": "1_off_topic_user",
      "instruction_id": "1",
      "domain": "rider_operations",
      "profile_id": "off_topic_user",
      "persona": "越界提问用户",
      "goal": "提出超出职责范围的问题，测试兜底回复。",
      "style": [
        "跳出主题",
        "询问非脚本内容"
      ],
      "trigger_scenarios": [
        "out_of_scope_question"
      ],
      "must_cover": [
        "提出1个超范围问题",
        "观察是否使用指定兜底策略"
      ],
      "initial_user_utterance": "先别说这个，我问你别的。",
      "initial_state_id": "ask_out_of_scope",
      "max_turns": 4,
      "states": [
        {
          "state_id": "ask_out_of_scope",
          "intent": "out_of_scope",
          "default_response": "那你顺便告诉我别的规则怎么处理？",
          "expected_agent_signals": [
            "你好",
            "通知",
            "升级",
            "合同"
          ],
          "fallback_response": "我问的不是这个。",
          "transition_to": "return_to_main_topic",
          "terminal": false
        },